{
  "$schema": "https://json-schema.org/draft/2020-12/schema",
  "$id": "https://rayleabot.local/contracts/backup-manifest.schema.json",
  "title": "RayleaBot Backup Manifest",
  "description": "Formal schema for current-format backup-manifest.json used by backup, restore, launcher fallback and fresh-install recovery drills.",
  "type": "object",
  "additionalProperties": false,
  "required": [
    "version",
    "created_at",
    "core_version",
    "config_schema_version",
    "db_schema_version",
    "plugin_manifest_version",
    "plugin_protocol_version",
    "plugin_artifact_version",
    "consistency",
    "directories"
  ],
  "properties": {
    "version": {
      "type": "string",
      "const": "3"
    },
    "created_at": {
      "type": "string",
      "format": "date-time"
    },
    "core_version": {
      "description": "Installed build version, or unknown when valid build metadata is unavailable. Unknown is not a semantic version and must not participate in version ordering.",
      "anyOf": [
        {
          "$ref": "#/$defs/semver"
        },
        {
          "const": "unknown"
        }
      ]
    },
    "config_schema_version": {
      "type": "string",
      "const": "4",
      "description": "Current schema version read from the archived user configuration."
    },
    "db_schema_version": {
      "type": "string",
      "enum": [
        "000001",
        "000002",
        "000003",
        "000004",
        "000005",
        "000006",
        "000007",
        "000008",
        "absent"
      ],
      "description": "Actual archived SQLite version: 000001, 000002, 000003, 000004, 000005, 000006, 000007 or 000008; absent means no database. Restore accepts versions registered in the forward migration chain, and first startup migrates old structures. Never relabel archived data. Downgrades are not supported."
    },
    "plugin_manifest_version": {
      "type": "string",
      "enum": [
        "3",
        "4"
      ],
      "description": "Plugin contract version supported by the core that created the backup. Archives from version 3 remain restorable; their v3 packages stay unsupported until rebuilt."
    },
    "plugin_protocol_version": {
      "type": "string",
      "enum": [
        "3",
        "4"
      ],
      "description": "Plugin contract version supported by the core that created the backup. Archives from version 3 remain restorable; their v3 packages stay unsupported until rebuilt."
    },
    "plugin_artifact_version": {
      "type": "string",
      "const": "2"
    },
    "plugin_ui_bridge_version": {
      "type": "string",
      "enum": [
        "3"
      ],
      "description": "Written only by archives created before the plugin management bridge was retired; restore accepts and ignores it."
    },
    "consistency": {
      "type": "string",
      "enum": [
        "offline",
        "online"
      ]
    },
    "plugins": {
      "type": "array",
      "items": {
        "$ref": "#/$defs/plugin"
      },
      "uniqueItems": true
    },
    "directories": {
      "type": "array",
      "items": {
        "$ref": "#/$defs/directory"
      },
      "minItems": 1
    }
  },
  "$defs": {
    "semver": {
      "type": "string",
      "pattern": "^(0|[1-9]\\d*)\\.(0|[1-9]\\d*)\\.(0|[1-9]\\d*)(?:-[0-9A-Za-z.-]+)?(?:\\+[0-9A-Za-z.-]+)?$"
    },
    "directory": {
      "type": "object",
      "description": "Current archive roots are fixed: config/user.yaml, data/rayleabot.db, data, and plugins/installed for their respective labels. Database restoration uses the archived effective configuration: portable relative paths are retained, absolute source paths become data/rayleabot.db inside the target root. Unsafe relative paths are rejected.",
      "additionalProperties": false,
      "required": [
        "label",
        "path"
      ],
      "properties": {
        "label": {
          "type": "string",
          "enum": [
            "config",
            "database",
            "data",
            "plugins"
          ]
        },
        "path": {
          "type": "string",
          "minLength": 1
        }
      },
      "oneOf": [
        {
          "properties": {
            "label": {
              "const": "config"
            },
            "path": {
              "const": "config/user.yaml"
            }
          }
        },
        {
          "properties": {
            "label": {
              "const": "database"
            },
            "path": {
              "const": "data/rayleabot.db"
            }
          }
        },
        {
          "properties": {
            "label": {
              "const": "data"
            },
            "path": {
              "const": "data"
            }
          }
        },
        {
          "properties": {
            "label": {
              "const": "plugins"
            },
            "path": {
              "const": "plugins/installed"
            }
          }
        }
      ]
    },
    "plugin": {
      "type": "object",
      "additionalProperties": false,
      "required": [
        "plugin_id",
        "manifest_version",
        "protocol_version",
        "artifact_version"
      ],
      "properties": {
        "plugin_id": {
          "type": "string",
          "pattern": "^[a-z0-9](?:[a-z0-9._-]{0,62}[a-z0-9])?$"
        },
        "manifest_version": {
          "type": "string",
          "enum": [
            "3",
            "4"
          ],
          "description": "Manifest version read from the installed package."
        },
        "protocol_version": {
          "type": "string",
          "enum": [
            "3",
            "4"
          ]
        },
        "artifact_version": {
          "type": "string",
          "const": "2"
        },
        "version": {
          "$ref": "#/$defs/semver"
        },
        "min_core_version": {
          "$ref": "#/$defs/semver"
        },
        "source_root": {
          "type": "string",
          "enum": [
            "plugins/installed"
          ]
        }
      }
    }
  },
  "x-fixtures": [
    "fixtures/backup-manifest/ok.minimal.json",
    "fixtures/backup-manifest/ok.unknown-core-version.json",
    "fixtures/backup-manifest/edge.config-only.json",
    "fixtures/backup-manifest/invalid.missing-schema-versions.json",
    "fixtures/backup-manifest/edge.plugin-inventory.json",
    "fixtures/backup-manifest/ok.schema-000002.json",
    "fixtures/backup-manifest/ok.schema-000003.json",
    "fixtures/backup-manifest/ok.schema-000004.json",
    "fixtures/backup-manifest/ok.schema-000005.json",
    "fixtures/backup-manifest/ok.schema-000006.json",
    "fixtures/backup-manifest/ok.schema-000007.json",
    "fixtures/backup-manifest/ok.schema-000008.json"
  ]
}
