{
  "version": "3",
  "created_at": "2026-10-01T08:00:00Z",
  "core_version": "0.7.0",
  "config_schema_version": "4",
  "db_schema_version": "000004",
  "consistency": "offline",
  "directories": [
    {
      "label": "config",
      "path": "config/user.yaml"
    },
    {
      "label": "database",
      "path": "data/rayleabot.db"
    }
  ],
  "plugin_manifest_version": "4",
  "plugin_protocol_version": "4",
  "plugin_artifact_version": "2"
}
