{
  "version": "3",
  "created_at": "2026-09-10T00:00:00Z",
  "core_version": "unknown",
  "config_schema_version": "4",
  "db_schema_version": "absent",
  "plugin_manifest_version": "3",
  "plugin_protocol_version": "3",
  "plugin_artifact_version": "2",
  "plugin_ui_bridge_version": "3",
  "consistency": "offline",
  "directories": [{"label": "config", "path": "config/user.yaml"}]
}
