{
  "version": "3",
  "created_at": "2026-04-02T08:00:00Z",
  "core_version": "unknown",
  "config_schema_version": "4",
  "db_schema_version": "000001",
  "consistency": "offline",
  "directories": [
    {
      "label": "config",
      "path": "config/user.yaml"
    },
    {
      "label": "database",
      "path": "data/rayleabot.db"
    }
  ],
  "plugin_manifest_version": "3",
  "plugin_protocol_version": "3",
  "plugin_artifact_version": "2",
  "plugin_ui_bridge_version": "3"
}
