{
  "version": "3",
  "created_at": "2026-04-02T08:00:00Z",
  "core_version": "0.2.0",
  "config_schema_version": "4",
  "db_schema_version": "000001",
  "plugin_manifest_version": "4",
  "plugin_protocol_version": "4",
  "plugin_artifact_version": "2",
  "consistency": "offline",
  "plugins": [
    {
      "plugin_id": "weather-pro",
      "manifest_version": "4",
      "protocol_version": "4",
      "artifact_version": "2",
      "version": "1.4.0",
      "min_core_version": "0.4.0",
      "source_root": "plugins/installed"
    }
  ],
  "directories": [
    {
      "label": "config",
      "path": "config/user.yaml"
    },
    {
      "label": "database",
      "path": "data/rayleabot.db"
    },
    {
      "label": "plugins",
      "path": "plugins/installed"
    }
  ]
}
